<?xml version='1.0' encoding='utf-8'?>
<!DOCTYPE list SYSTEM "events.dtd">
<list>
	<event id="106" name="Narsell Fortress" impl="FortressSiege">
		<on_init>
			<spawn name="fortress_peace_npcs"/>
			<init name="upgradeable_doors"/>
			<init name="commander_doors"/>
			<init name="enter_doors"/>
			<init name="siege_zones"/>
			<init name="flag_zones"/>
			<spawn name="flag_pole"/>
			<spawn name="peace_commanders"/>
		</on_init>
		<on_start>
			<despawn name="peace_commanders"/>
			<!--Спавним гвардов-->
			<spawn name="default_guards"/>
			<spawn name="guards_live_with_c_center"/>
			<spawn name="siege_commanders"/>
			<if name="old_owner">
				<spawn name="owner_flagdef"/>
				<spawn name="mercenary"/>
			</if>
			<else>
				<spawn name="noowner_flagdef"/>
			</else>
			<if name="reinforce_1">
				<spawn name="reinforce_1"/>
			</if>
			<if name="reinforce_2">
				<spawn name="reinforce_2"/>
			</if>
			<if name="dwarvens">
				<spawn name="dwarvens"/>
			</if>
			<!--Обновляем двери-->
			<refresh name="upgradeable_doors"/>
			<refresh name="commander_doors"/>
			<active name="siege_zones"/>
			<teleport_players id="attackers"/>
			<teleport_players id="spectators"/>
		</on_start>
		<on_stop>
			<if name="old_owner">
				<despawn name="owner_flagdef"/>
				<despawn name="mercenary"/>
			</if>
			<else>
				<despawn name="noowner_flagdef"/>
			</else>
			<despawn name="reinforce_1"/>
			<despawn name="reinforce_2"/>
			<despawn name="dwarvens"/>
			<despawn name="default_guards"/>
			<despawn name="guards_live_with_c_center"/>
			<despawn name="siege_commanders"/>

			<!--Капитаны и менчант-->
			<spawn name="peace_commanders"/>

			<!--Обновляем двери-->
			<refresh name="upgradeable_doors"/>
			<refresh name="commander_doors"/>
			<teleport_players id="spectators"/>
			<deactive name="siege_zones"/>
		</on_stop>
		<on_time>
			<on time="-3600">
				<announce val="3600"/>
			</on>
			<on time="-1800">
				<announce val="1800"/>
			</on>
			<on time="-600"> <!--10 min to siege-->
				<announce val="600"/>
				<stop name="registration"/>
				<despawn name="merchant"/>
			</on>
			<on time="-5">
				<announce val="5"/>
			</on>
			<on time="-4">
				<announce val="4"/>
			</on>
			<on time="-3">
				<announce val="3"/>
			</on>
			<on time="-2">
				<announce val="2"/>
			</on>
			<on time="-1">
				<announce val="1"/>
			</on>
			<on time="0">
				<start name="event"/>
				<play_sound type="SOUND" range="-1" sound="NS20_F"/>
			</on>
			<on time="98">
				<play_sound type="SOUND" range="-1" sound="NB02_F"/>
			</on>
			<on time="200">
				<play_sound type="SOUND" range="-1" sound="NS19_S01"/>
			</on>
			<on time="300">
				<give_item id="-300" count="310"/>
			</on>
			<on time="310">
				<play_sound type="SOUND" range="-1" sound="NS12_F"/>
			</on>
			<on time="403">
				<play_sound type="SOUND" range="-1" sound="NS19_F"/>
			</on>
			<on time="512">
				<play_sound type="SOUND" range="-1" sound="NS18_S01"/>
			</on>
			<on time="596">
				<play_sound type="SOUND" range="-1" sound="NS02_F"/>
			</on>
			<on time="600">
				<give_item id="-300" count="310"/>
			</on>
			<on time="691">
				<play_sound type="SOUND" range="-1" sound="NS12_S01"/>
			</on>
			<on time="785">
				<play_sound type="SOUND" range="-1" sound="NS18_F"/>
			</on>
			<on time="883">
				<play_sound type="SOUND" range="-1" sound="NS02_S01"/>
			</on>
			<on time="900">
				<give_item id="-300" count="310"/>
			</on>
			<on time="978">
				<play_sound type="SOUND" range="-1" sound="NS20_F"/>
			</on>
			<on time="1076">
				<play_sound type="SOUND" range="-1" sound="NB02_F"/>
			</on>
			<on time="1178">
				<play_sound type="SOUND" range="-1" sound="NS19_S01"/>
			</on>
			<on time="1200">
				<give_item id="-300" count="310"/>
			</on>
			<on time="1288">
				<play_sound type="SOUND" range="-1" sound="NS12_F"/>
			</on>
			<on time="1381">
				<play_sound type="SOUND" range="-1" sound="NS19_F"/>
			</on>
			<on time="1490">
				<play_sound type="SOUND" range="-1" sound="NS18_S01"/>
			</on>
			<on time="1500">
				<give_item id="-300" count="310"/>
			</on>
			<on time="1574">
				<play_sound type="SOUND" range="-1" sound="NS02_F"/>
			</on>
			<on time="1669">
				<play_sound type="SOUND" range="-1" sound="NS12_S01"/>
			</on>
			<on time="1763">
				<play_sound type="SOUND" range="-1" sound="NS18_F"/>
			</on>
			<on time="1800">
				<give_item id="-300" count="310"/>
			</on>
			<on time="1861">
				<play_sound type="SOUND" range="-1" sound="NS02_S01"/>
			</on>
			<on time="1956">
				<play_sound type="SOUND" range="-1" sound="NS20_F"/>
			</on>
			<on time="2054">
				<play_sound type="SOUND" range="-1" sound="NB02_F"/>
			</on>
			<on time="2100">
				<give_item id="-300" count="310"/>
			</on>
			<on time="2156">
				<play_sound type="SOUND" range="-1" sound="NS19_S01"/>
			</on>
			<on time="2266">
				<play_sound type="SOUND" range="-1" sound="NS12_F"/>
			</on>
			<on time="2359">
				<play_sound type="SOUND" range="-1" sound="NS19_F"/>
			</on>
			<on time="2400">
				<give_item id="-300" count="310"/>
			</on>
			<on time="2468">
				<play_sound type="SOUND" range="-1" sound="NS18_S01"/>
			</on>
			<on time="2552">
				<play_sound type="SOUND" range="-1" sound="NS02_F"/>
			</on>
			<on time="2647">
				<play_sound type="SOUND" range="-1" sound="NS12_S01"/>
			</on>
			<on time="2700">
				<give_item id="-300" count="310"/>
			</on>
			<on time="2741">
				<play_sound type="SOUND" range="-1" sound="NS18_F"/>
			</on>
			<on time="2839">
				<play_sound type="SOUND" range="-1" sound="NS02_S01"/>
			</on>
			<on time="2934">
				<play_sound type="SOUND" range="-1" sound="NS20_F"/>
			</on>
			<on time="3000">
				<give_item id="-300" count="310"/>
			</on>
			<on time="3032">
				<play_sound type="SOUND" range="-1" sound="NB02_F"/>
			</on>
			<on time="3134">
				<play_sound type="SOUND" range="-1" sound="NS19_S01"/>
			</on>
			<on time="3227">
				<play_sound type="SOUND" range="-1" sound="NS12_F"/>
			</on>
			<on time="3300">
				<give_item id="-300" count="310"/>
			</on>
			<on time="3320">
				<play_sound type="SOUND" range="-1" sound="NS19_F"/>
			</on>
			<on time="3429">
				<play_sound type="SOUND" range="-1" sound="NS18_S01"/>
			</on>
			<on time="3513">
				<play_sound type="SOUND" range="-1" sound="NS02_F"/>
			</on>
			<on time="3600">
				<stop name="event"/>
			</on>
		</on_time>
		<objects name="fortress_peace_npcs">
			<spawn name="narsell_fortress_106"/>
		</objects>
		<objects name="merchant">
			<spawn_ex name="narsell_fortress_peace_merchant"/>
		</objects>
		<objects name="flag_pole">
			<static_object id="24190500"/>
		</objects>
		<objects name="combat_flags">
			<combat_flag x="154638" y="55407" z="-3123"/>
			<combat_flag x="154687" y="55480" z="-3123"/>
			<combat_flag x="154742" y="55541" z="-3123"/>
		</objects>
		<objects name="peace_commanders">
			<spawn_ex name="narsell_fortress_peace_commanders"/>
		</objects>
		<objects name="siege_commanders">
			<spawn_ex name="narsell_fortress_siege_commanders"/>
		</objects>
		<objects name="envoy">
			<spawn_ex name="narsell_fortress_envoy"/>
		</objects>
		<objects name="default_guards"> <!--дефольтные гварды спавнятся при любых условиях-->
			<spawn_ex name="narsell_fortress_default_guards"/>
		</objects>
		<objects name="guards_live_with_c_center"> <!--гварды которые будут стоят пока не вворвутся в командый центр-->
			<spawn_ex name="narsell_fortress_live_with_c_center"/>
		</objects>
		<objects name="noowner_flagdef"> <!--гварды охраняемые Флагполе, когда нету овнера-->
			<spawn_ex name="narsell_fortress_noowner_flagdef"/>
		</objects>
		<objects name="owner_flagdef"> <!--гварды охраняемые Флагполе, когда есть овнера-->
			<spawn_ex name="narsell_fortress_owner_flagdef"/>
		</objects>
		<objects name="dwarvens">
			<spawn_ex name="narsell_fortress_gunner"/>
		</objects>
		<objects name="reinforce_1">
			<spawn_ex name="narsell_fortress_reinforce_1"/>
		</objects>
		<objects name="reinforce_2">
			<spawn_ex name="narsell_fortress_reinforce_2"/>
		</objects>
		<objects name="enter_doors">
			<door id="24190005"/>
			<door id="24190010"/>
		</objects>
		<objects name="upgradeable_doors">
			<door id="24190005"/>
			<door id="24190010"/>
			<door id="24190011"/>
			<door id="24190012"/>
		</objects>
		<objects name="commander_doors">
			<door id="24190006"/>
			<door id="24190007"/>
			<door id="24190008"/>
			<door id="24190009"/>
		</objects>
		<objects name="mercenary_points">
			<point x="151251" y="58391" z="-3368"/>
			<point x="151526" y="58194" z="-3296"/>
			<point x="151782" y="57978" z="-3280"/>
			<point x="152220" y="57619" z="-3280"/>
			<point x="152573" y="57328" z="-3280"/>
			<point x="152890" y="57077" z="-3248"/>
			<point x="153146" y="56857" z="-3256"/>
			<point x="153514" y="56539" z="-3256"/>
			<point x="153870" y="56202" z="-3256"/>
			<point x="154264" y="55835" z="-3256"/>
		</objects>
		<objects name="mercenary">
			<spawn_ex name="narsell_fortress_mercenary"/>
		</objects>
		<objects name="siege_zones">
			<zone name="[aden_fort_a_siege]"/>
		</objects>
		<objects name="flag_zones">
			<zone name="[aden_fort_a_hq]"/>
		</objects>
	</event>
</list>