<?xml version='1.0' encoding='utf-8'?>
<!DOCTYPE list SYSTEM "events.dtd">
<!--AUTHOR: Bonux-->
<list>
	<event id="200" name="CityOfArcan2_Shuttle" impl="ShuttleWay">
		<parameter name="shuttle_id" value="2"/>
		<parameter name="spawn_point" value="209885 83357 -1035 0"/>
		<parameter name="next_floor_loc" value="209885 83357 85"/>
		<parameter name="floor_doors_id" value="0"/>
		<parameter name="speed" value="300"/>
		<parameter name="return_point" value="209428 83662 -992"/>
		<on_init>
			<init name="doors"/>
		</on_init>
		<on_start>
			<close name="doors"/>
		</on_start>
		<on_time>
			<on time="0">
				<open name="doors"/>
			</on>
			<on time="17">
				<start name="event"/>
			</on>
		</on_time>
		<objects name="doors">
			<door id="26200003"/>
		</objects>
	</event>
	<event id="201" name="CityOfArcan2_Shuttle" impl="ShuttleWay">
		<parameter name="next_floor_loc" value="209885 83357 -1035"/>
		<parameter name="floor_doors_id" value="1"/>
		<parameter name="speed" value="300"/>
		<parameter name="return_point" value="209428 83662 -992"/>
		<on_init>
			<init name="doors"/>
		</on_init>
		<on_start>
			<close name="doors"/>
		</on_start>
		<on_time>
			<on time="0">
				<open name="doors"/>
			</on>
			<on time="17">
				<start name="event"/>
			</on>
		</on_time>
		<objects name="doors">
			<door id="26200004"/>
		</objects>
	</event>
</list>